file_name,file_path,height,width,image_id,caption
COCO_train2014_000000003225.jpg,/home/harsh/fiftyone/coco-2014/train/data/COCO_train2014_000000003225.jpg,640,434,3225,A young child in a hooded winter jacket holding a baseball bat.
COCO_train2014_000000004502.jpg,/home/harsh/fiftyone/coco-2014/train/data/COCO_train2014_000000004502.jpg,481,640,4502,A girl and boy in a field playing tennis.
COCO_train2014_000000004502.jpg,/home/harsh/fiftyone/coco-2014/train/data/COCO_train2014_000000004502.jpg,481,640,4502,A woman standing on a field of grass holding a tennis racquet.
COCO_train2014_000000004502.jpg,/home/harsh/fiftyone/coco-2014/train/data/COCO_train2014_000000004502.jpg,481,640,4502,Two children play badminton with a windmill in the background.
COCO_train2014_000000004502.jpg,/home/harsh/fiftyone/coco-2014/train/data/COCO_train2014_000000004502.jpg,481,640,4502,It is always more fun to play badminton in front of a windmill.
COCO_train2014_000000004502.jpg,/home/harsh/fiftyone/coco-2014/train/data/COCO_train2014_000000004502.jpg,481,640,4502,A girl and a boy is playing tennis. 
COCO_train2014_000000005715.jpg,/home/harsh/fiftyone/coco-2014/train/data/COCO_train2014_000000005715.jpg,640,425,5715,A woman wearing a yellow dress while holding a rainbow umbrella.
COCO_train2014_000000005715.jpg,/home/harsh/fiftyone/coco-2014/train/data/COCO_train2014_000000005715.jpg,640,425,5715,A woman wearing a bunch of accessories and holding a colorful umbrella
COCO_train2014_000000005715.jpg,/home/harsh/fiftyone/coco-2014/train/data/COCO_train2014_000000005715.jpg,640,425,5715,a person holding an umbrella on a street.
COCO_train2014_000000005715.jpg,/home/harsh/fiftyone/coco-2014/train/data/COCO_train2014_000000005715.jpg,640,425,5715,A man dress in ladies' clothing with an ope umbrella. 
COCO_train2014_000000005715.jpg,/home/harsh/fiftyone/coco-2014/train/data/COCO_train2014_000000005715.jpg,640,425,5715,"A man dressed at a woman with sunglasses on and a yellow dress, holding a multicolored umbrella on a sunny day."
COCO_train2014_000000001947.jpg,/home/harsh/fiftyone/coco-2014/train/data/COCO_train2014_000000001947.jpg,375,500,1947,A group of people at a table with laptops.
COCO_train2014_000000001947.jpg,/home/harsh/fiftyone/coco-2014/train/data/COCO_train2014_000000001947.jpg,375,500,1947,A group of people that are around a table.
COCO_train2014_000000001947.jpg,/home/harsh/fiftyone/coco-2014/train/data/COCO_train2014_000000001947.jpg,375,500,1947,A group of men sitting around a table using computers.
COCO_train2014_000000001947.jpg,/home/harsh/fiftyone/coco-2014/train/data/COCO_train2014_000000001947.jpg,375,500,1947,A group of men sitting at an editing table with laptops.
COCO_train2014_000000001947.jpg,/home/harsh/fiftyone/coco-2014/train/data/COCO_train2014_000000001947.jpg,375,500,1947,A group of men around a wooden table with laptops
COCO_train2014_000000000260.jpg,/home/harsh/fiftyone/coco-2014/train/data/COCO_train2014_000000000260.jpg,333,500,260,A female traveler leaning on a luggage cart.
COCO_train2014_000000000260.jpg,/home/harsh/fiftyone/coco-2014/train/data/COCO_train2014_000000000260.jpg,333,500,260,A woman is waiting with a cart full of luggage.
COCO_train2014_000000000260.jpg,/home/harsh/fiftyone/coco-2014/train/data/COCO_train2014_000000000260.jpg,333,500,260,A woman next to a cart of luggage at a bus stop.
COCO_train2014_000000000260.jpg,/home/harsh/fiftyone/coco-2014/train/data/COCO_train2014_000000000260.jpg,333,500,260,the woman is standing with her luggage 
COCO_train2014_000000000260.jpg,/home/harsh/fiftyone/coco-2014/train/data/COCO_train2014_000000000260.jpg,333,500,260,A woman wearing a yellow shirt standing next to luggage.
COCO_train2014_000000001810.jpg,/home/harsh/fiftyone/coco-2014/train/data/COCO_train2014_000000001810.jpg,500,500,1810,Small white bowl full of re-fried beans next to a toaster.
COCO_train2014_000000001810.jpg,/home/harsh/fiftyone/coco-2014/train/data/COCO_train2014_000000001810.jpg,500,500,1810,A bowl of beans and a cup on a table.
COCO_train2014_000000001810.jpg,/home/harsh/fiftyone/coco-2014/train/data/COCO_train2014_000000001810.jpg,500,500,1810,A bowl of soup is reflected in a silver toaster. 
COCO_train2014_000000001810.jpg,/home/harsh/fiftyone/coco-2014/train/data/COCO_train2014_000000001810.jpg,500,500,1810,BOWL OF PORK AND BEANS AND CUP IN FRONT OF A TOASTER
COCO_train2014_000000001810.jpg,/home/harsh/fiftyone/coco-2014/train/data/COCO_train2014_000000001810.jpg,500,500,1810,a silver toaster a cup and a bowl of beans
COCO_train2014_000000005294.jpg,/home/harsh/fiftyone/coco-2014/train/data/COCO_train2014_000000005294.jpg,413,640,5294,a few people are reading news papers on the street
COCO_train2014_000000005294.jpg,/home/harsh/fiftyone/coco-2014/train/data/COCO_train2014_000000005294.jpg,413,640,5294,Men are sitting on park benches reading the newspaper.
COCO_train2014_000000005294.jpg,/home/harsh/fiftyone/coco-2014/train/data/COCO_train2014_000000005294.jpg,413,640,5294,several people sitting on a street bench in the fifties reading newspapers
COCO_train2014_000000005294.jpg,/home/harsh/fiftyone/coco-2014/train/data/COCO_train2014_000000005294.jpg,413,640,5294,People reading newspapers while sitting on a bench located on a busy street.
COCO_train2014_000000005294.jpg,/home/harsh/fiftyone/coco-2014/train/data/COCO_train2014_000000005294.jpg,413,640,5294,Three people are sitting on a bench while they read a newspaper.
COCO_train2014_000000000094.jpg,/home/harsh/fiftyone/coco-2014/train/data/COCO_train2014_000000000094.jpg,427,640,94,There is a street lined with packed buildings
COCO_train2014_000000000094.jpg,/home/harsh/fiftyone/coco-2014/train/data/COCO_train2014_000000000094.jpg,427,640,94,There is a car driving down a street with buildings on each side.
COCO_train2014_000000000094.jpg,/home/harsh/fiftyone/coco-2014/train/data/COCO_train2014_000000000094.jpg,427,640,94,A street sign and a car on the road.
COCO_train2014_000000000094.jpg,/home/harsh/fiftyone/coco-2014/train/data/COCO_train2014_000000000094.jpg,427,640,94,This is a view of a quaint city street.
COCO_train2014_000000000094.jpg,/home/harsh/fiftyone/coco-2014/train/data/COCO_train2014_000000000094.jpg,427,640,94,"A city street with a sign that reads ""Peace Way Hotel""."
COCO_train2014_000000005377.jpg,/home/harsh/fiftyone/coco-2014/train/data/COCO_train2014_000000005377.jpg,500,333,5377,A family of three people that are on the beach.
COCO_train2014_000000005377.jpg,/home/harsh/fiftyone/coco-2014/train/data/COCO_train2014_000000005377.jpg,500,333,5377,A family is reading a sign by the sea.
COCO_train2014_000000005377.jpg,/home/harsh/fiftyone/coco-2014/train/data/COCO_train2014_000000005377.jpg,500,333,5377,a couple of people are standing in front of a sign
COCO_train2014_000000005377.jpg,/home/harsh/fiftyone/coco-2014/train/data/COCO_train2014_000000005377.jpg,500,333,5377,A couple of people standing on either side of a sign.
COCO_train2014_000000005377.jpg,/home/harsh/fiftyone/coco-2014/train/data/COCO_train2014_000000005377.jpg,500,333,5377,A family reads the signs posted at a public beach.
COCO_train2014_000000003535.jpg,/home/harsh/fiftyone/coco-2014/train/data/COCO_train2014_000000003535.jpg,480,640,3535,there is a construction working fixing a street sign
COCO_train2014_000000003535.jpg,/home/harsh/fiftyone/coco-2014/train/data/COCO_train2014_000000003535.jpg,480,640,3535,A person working on a traffic signal in a city.
COCO_train2014_000000003535.jpg,/home/harsh/fiftyone/coco-2014/train/data/COCO_train2014_000000003535.jpg,480,640,3535,a person fixing a traffic light on a pole 
COCO_train2014_000000003535.jpg,/home/harsh/fiftyone/coco-2014/train/data/COCO_train2014_000000003535.jpg,480,640,3535,A person standing next to a pole working on a traffic signal.
COCO_train2014_000000003535.jpg,/home/harsh/fiftyone/coco-2014/train/data/COCO_train2014_000000003535.jpg,480,640,3535,A man working on a road sign near the streer
COCO_train2014_000000005669.jpg,/home/harsh/fiftyone/coco-2014/train/data/COCO_train2014_000000005669.jpg,480,640,5669,The stop sign post is covered with deep snow. 
COCO_train2014_000000005669.jpg,/home/harsh/fiftyone/coco-2014/train/data/COCO_train2014_000000005669.jpg,480,640,5669,a stop sign buried in tall snow 
COCO_train2014_000000005669.jpg,/home/harsh/fiftyone/coco-2014/train/data/COCO_train2014_000000005669.jpg,480,640,5669,A stop sign that is almost buried in the snow.
COCO_train2014_000000005669.jpg,/home/harsh/fiftyone/coco-2014/train/data/COCO_train2014_000000005669.jpg,480,640,5669,"a stop sign in the snow, with snow covered mountains in background."
COCO_train2014_000000005669.jpg,/home/harsh/fiftyone/coco-2014/train/data/COCO_train2014_000000005669.jpg,480,640,5669,A red stop sign sitting in the middle of a snow covered field.
COCO_train2014_000000005237.jpg,/home/harsh/fiftyone/coco-2014/train/data/COCO_train2014_000000005237.jpg,347,640,5237,a number of small boats in body of water
COCO_train2014_000000005237.jpg,/home/harsh/fiftyone/coco-2014/train/data/COCO_train2014_000000005237.jpg,347,640,5237,"Looking at a quaint, old town across a placid marina"
COCO_train2014_000000005237.jpg,/home/harsh/fiftyone/coco-2014/train/data/COCO_train2014_000000005237.jpg,347,640,5237,Many boats are docked in the water next to a stone canal.
COCO_train2014_000000005237.jpg,/home/harsh/fiftyone/coco-2014/train/data/COCO_train2014_000000005237.jpg,347,640,5237,A line of boats docked in a semi-circle at a dock in a harbor.
COCO_train2014_000000005237.jpg,/home/harsh/fiftyone/coco-2014/train/data/COCO_train2014_000000005237.jpg,347,640,5237,A harbor filled with lots of small boats.
COCO_train2014_000000002470.jpg,/home/harsh/fiftyone/coco-2014/train/data/COCO_train2014_000000002470.jpg,640,637,2470,Snowboarder on large snow covered slope in alpine area.
COCO_train2014_000000002470.jpg,/home/harsh/fiftyone/coco-2014/train/data/COCO_train2014_000000002470.jpg,640,637,2470,A man riding a snowboard down a snow covered slope.
COCO_train2014_000000002470.jpg,/home/harsh/fiftyone/coco-2014/train/data/COCO_train2014_000000002470.jpg,640,637,2470,A person riding a snowboard down a slope with other people behind him.
COCO_train2014_000000002470.jpg,/home/harsh/fiftyone/coco-2014/train/data/COCO_train2014_000000002470.jpg,640,637,2470,a man on a snow board cutting up some snow 
COCO_train2014_000000002470.jpg,/home/harsh/fiftyone/coco-2014/train/data/COCO_train2014_000000002470.jpg,640,637,2470,A person is coming down a hill on a snowboard.
COCO_train2014_000000000436.jpg,/home/harsh/fiftyone/coco-2014/train/data/COCO_train2014_000000000436.jpg,640,427,436,A person licks his thumb while holding a piece of food.
COCO_train2014_000000000436.jpg,/home/harsh/fiftyone/coco-2014/train/data/COCO_train2014_000000000436.jpg,640,427,436,there is a person sitting and licking their fingers
COCO_train2014_000000000436.jpg,/home/harsh/fiftyone/coco-2014/train/data/COCO_train2014_000000000436.jpg,640,427,436,A man is eating a roll and licking his thumb.
COCO_train2014_000000000436.jpg,/home/harsh/fiftyone/coco-2014/train/data/COCO_train2014_000000000436.jpg,640,427,436,A man licking his thumb with a peanut buttered bread slice in his hand.
COCO_train2014_000000000436.jpg,/home/harsh/fiftyone/coco-2014/train/data/COCO_train2014_000000000436.jpg,640,427,436,Man wearing glasses eating a slice of food.
COCO_train2014_000000003770.jpg,/home/harsh/fiftyone/coco-2014/train/data/COCO_train2014_000000003770.jpg,640,516,3770,A girl playing tennis while hitting a serve
COCO_train2014_000000003770.jpg,/home/harsh/fiftyone/coco-2014/train/data/COCO_train2014_000000003770.jpg,640,516,3770,The girl is wearing a red and white tennis dress and has her racquet ready to hit. 
COCO_train2014_000000003770.jpg,/home/harsh/fiftyone/coco-2014/train/data/COCO_train2014_000000003770.jpg,640,516,3770,A girl in a red and white tennis outfit is hitting a tennis ball.
COCO_train2014_000000003770.jpg,/home/harsh/fiftyone/coco-2014/train/data/COCO_train2014_000000003770.jpg,640,516,3770,A woman has just hit the tennis ball with her racket.
COCO_train2014_000000003770.jpg,/home/harsh/fiftyone/coco-2014/train/data/COCO_train2014_000000003770.jpg,640,516,3770,A tennis player leaps to hit the ball.
COCO_train2014_000000002931.jpg,/home/harsh/fiftyone/coco-2014/train/data/COCO_train2014_000000002931.jpg,492,500,2931,A close shot of a red clock in the daylight. 
COCO_train2014_000000002931.jpg,/home/harsh/fiftyone/coco-2014/train/data/COCO_train2014_000000002931.jpg,492,500,2931,Large sitting clock tower pointing to the sky. 
COCO_train2014_000000002931.jpg,/home/harsh/fiftyone/coco-2014/train/data/COCO_train2014_000000002931.jpg,492,500,2931,The big clock and tower are bright red.
COCO_train2014_000000002931.jpg,/home/harsh/fiftyone/coco-2014/train/data/COCO_train2014_000000002931.jpg,492,500,2931,An outdoor analog clock beside a red lighthouse on a sunny day.
COCO_train2014_000000002931.jpg,/home/harsh/fiftyone/coco-2014/train/data/COCO_train2014_000000002931.jpg,492,500,2931,A clock on a pole that is next to a lighthouse.
COCO_train2014_000000002860.jpg,/home/harsh/fiftyone/coco-2014/train/data/COCO_train2014_000000002860.jpg,480,640,2860,A turquoise compact car with a bicycle on a rack on top of it.
COCO_train2014_000000002860.jpg,/home/harsh/fiftyone/coco-2014/train/data/COCO_train2014_000000002860.jpg,480,640,2860,A car parked with a bike in a rack on the roof.
COCO_train2014_000000002860.jpg,/home/harsh/fiftyone/coco-2014/train/data/COCO_train2014_000000002860.jpg,480,640,2860,A bike is hooked up to the top of a car.
COCO_train2014_000000002860.jpg,/home/harsh/fiftyone/coco-2014/train/data/COCO_train2014_000000002860.jpg,480,640,2860,The blue car is parked in the parking lot with several other cars.
COCO_train2014_000000002860.jpg,/home/harsh/fiftyone/coco-2014/train/data/COCO_train2014_000000002860.jpg,480,640,2860,An aqua colored car with a bicycle in a roof rack.
COCO_train2014_000000000656.jpg,/home/harsh/fiftyone/coco-2014/train/data/COCO_train2014_000000000656.jpg,472,640,656,A motorcycle parked in a parking spot in a lot.
COCO_train2014_000000000656.jpg,/home/harsh/fiftyone/coco-2014/train/data/COCO_train2014_000000000656.jpg,472,640,656,there is a orange and black motorcycle that is parked 
COCO_train2014_000000000656.jpg,/home/harsh/fiftyone/coco-2014/train/data/COCO_train2014_000000000656.jpg,472,640,656,A gold motorcycle parked in parking lot next to a building.
COCO_train2014_000000000656.jpg,/home/harsh/fiftyone/coco-2014/train/data/COCO_train2014_000000000656.jpg,472,640,656,A motorcycle parked in a parking space in front of a store.
COCO_train2014_000000000656.jpg,/home/harsh/fiftyone/coco-2014/train/data/COCO_train2014_000000000656.jpg,472,640,656,A gold and black motorcycle is parked by some grass.
COCO_train2014_000000000595.jpg,/home/harsh/fiftyone/coco-2014/train/data/COCO_train2014_000000000595.jpg,480,640,595,A tv sitting next to a river with a busted screen.
COCO_train2014_000000000595.jpg,/home/harsh/fiftyone/coco-2014/train/data/COCO_train2014_000000000595.jpg,480,640,595,A television sitting in the middle of a river
COCO_train2014_000000000595.jpg,/home/harsh/fiftyone/coco-2014/train/data/COCO_train2014_000000000595.jpg,480,640,595,There is an old TV in the middle of a swamp
COCO_train2014_000000000595.jpg,/home/harsh/fiftyone/coco-2014/train/data/COCO_train2014_000000000595.jpg,480,640,595,An old TV monitor sits in the middle of a stream.
COCO_train2014_000000000595.jpg,/home/harsh/fiftyone/coco-2014/train/data/COCO_train2014_000000000595.jpg,480,640,595,A tv in the middle of a fast flowing river.
COCO_train2014_000000006560.jpg,/home/harsh/fiftyone/coco-2014/train/data/COCO_train2014_000000006560.jpg,427,640,6560,A large jetliner flying through a blue sky.
COCO_train2014_000000006560.jpg,/home/harsh/fiftyone/coco-2014/train/data/COCO_train2014_000000006560.jpg,427,640,6560,view from below of a plane flying through a blue sky
COCO_train2014_000000006560.jpg,/home/harsh/fiftyone/coco-2014/train/data/COCO_train2014_000000006560.jpg,427,640,6560,Looking up at a commercial jet airplane in a blue sky
COCO_train2014_000000006560.jpg,/home/harsh/fiftyone/coco-2014/train/data/COCO_train2014_000000006560.jpg,427,640,6560,A white and red commercial airplane flying overhead.
COCO_train2014_000000006560.jpg,/home/harsh/fiftyone/coco-2014/train/data/COCO_train2014_000000006560.jpg,427,640,6560,a emirates airline jet plane over head in flight
COCO_train2014_000000000753.jpg,/home/harsh/fiftyone/coco-2014/train/data/COCO_train2014_000000000753.jpg,640,426,753,A giraffe is turning its head to look at the photographer
COCO_train2014_000000000753.jpg,/home/harsh/fiftyone/coco-2014/train/data/COCO_train2014_000000000753.jpg,640,426,753,A giraffe standing and posing in a prairie setting.
COCO_train2014_000000000753.jpg,/home/harsh/fiftyone/coco-2014/train/data/COCO_train2014_000000000753.jpg,640,426,753,a giraffe standing in tall grass with trees in the background
COCO_train2014_000000000753.jpg,/home/harsh/fiftyone/coco-2014/train/data/COCO_train2014_000000000753.jpg,640,426,753,The giraffe is standing alone in the wilderness.
COCO_train2014_000000000753.jpg,/home/harsh/fiftyone/coco-2014/train/data/COCO_train2014_000000000753.jpg,640,426,753,A giraffe in a field staring at the camera.
COCO_train2014_000000001762.jpg,/home/harsh/fiftyone/coco-2014/train/data/COCO_train2014_000000001762.jpg,640,480,1762,A yellow and red bus traveling past a tall building.
COCO_train2014_000000001762.jpg,/home/harsh/fiftyone/coco-2014/train/data/COCO_train2014_000000001762.jpg,640,480,1762,A red and yellow city bus driving down the street
COCO_train2014_000000001762.jpg,/home/harsh/fiftyone/coco-2014/train/data/COCO_train2014_000000001762.jpg,640,480,1762,a colorful bus driving down a road next to another bus 
COCO_train2014_000000001762.jpg,/home/harsh/fiftyone/coco-2014/train/data/COCO_train2014_000000001762.jpg,640,480,1762,Buses move side by side to pass a building on the street.
COCO_train2014_000000001762.jpg,/home/harsh/fiftyone/coco-2014/train/data/COCO_train2014_000000001762.jpg,640,480,1762,A vehicle pulls up next to another vehicle.
COCO_train2014_000000001997.jpg,/home/harsh/fiftyone/coco-2014/train/data/COCO_train2014_000000001997.jpg,427,640,1997,A street sign on a pole that reads Rockefeller Plaza.
COCO_train2014_000000001997.jpg,/home/harsh/fiftyone/coco-2014/train/data/COCO_train2014_000000001997.jpg,427,640,1997,A picture of the Rockefeller Plaza street sign.
COCO_train2014_000000001997.jpg,/home/harsh/fiftyone/coco-2014/train/data/COCO_train2014_000000001997.jpg,427,640,1997,The sign indicates one way travel in front of Rockefeller Plaza.
COCO_train2014_000000001997.jpg,/home/harsh/fiftyone/coco-2014/train/data/COCO_train2014_000000001997.jpg,427,640,1997,A hanging street sign that says Rockefeller Plaza.
COCO_train2014_000000001997.jpg,/home/harsh/fiftyone/coco-2014/train/data/COCO_train2014_000000001997.jpg,427,640,1997,"A street sign that reads ""Rockefeller Plaza"" in front of trees filled with lights."
COCO_train2014_000000005994.jpg,/home/harsh/fiftyone/coco-2014/train/data/COCO_train2014_000000005994.jpg,640,340,5994,A bunch of signs that are near a building.
COCO_train2014_000000005994.jpg,/home/harsh/fiftyone/coco-2014/train/data/COCO_train2014_000000005994.jpg,640,340,5994,three pictures of some different looking street signs
COCO_train2014_000000005994.jpg,/home/harsh/fiftyone/coco-2014/train/data/COCO_train2014_000000005994.jpg,640,340,5994,Various street signs that read Danforth avenue 
COCO_train2014_000000005994.jpg,/home/harsh/fiftyone/coco-2014/train/data/COCO_train2014_000000005994.jpg,640,340,5994,Four signs showing different addresses for the same street name.
COCO_train2014_000000005994.jpg,/home/harsh/fiftyone/coco-2014/train/data/COCO_train2014_000000005994.jpg,640,340,5994,Multiple photos denoting street signs of Danforth Ave.
COCO_train2014_000000000575.jpg,/home/harsh/fiftyone/coco-2014/train/data/COCO_train2014_000000000575.jpg,513,640,575,a close up of a cat laying on grass near a shoe
COCO_train2014_000000000575.jpg,/home/harsh/fiftyone/coco-2014/train/data/COCO_train2014_000000000575.jpg,513,640,575,A cat is in the grass chewing on a shoestring. 
COCO_train2014_000000000575.jpg,/home/harsh/fiftyone/coco-2014/train/data/COCO_train2014_000000000575.jpg,513,640,575,an image of a cat that is playing with a shoe
COCO_train2014_000000000575.jpg,/home/harsh/fiftyone/coco-2014/train/data/COCO_train2014_000000000575.jpg,513,640,575,A cat playing with a shoe in a grassy field.
COCO_train2014_000000000575.jpg,/home/harsh/fiftyone/coco-2014/train/data/COCO_train2014_000000000575.jpg,513,640,575,The cat is laying in the grass next to a shoe. 
COCO_train2014_000000005483.jpg,/home/harsh/fiftyone/coco-2014/train/data/COCO_train2014_000000005483.jpg,568,640,5483,A store counter with some food in a building.
COCO_train2014_000000005483.jpg,/home/harsh/fiftyone/coco-2014/train/data/COCO_train2014_000000005483.jpg,568,640,5483,There are a lot of oranges in the store.
COCO_train2014_000000005483.jpg,/home/harsh/fiftyone/coco-2014/train/data/COCO_train2014_000000005483.jpg,568,640,5483,A store that sells oranges and different types of pastries
COCO_train2014_000000005483.jpg,/home/harsh/fiftyone/coco-2014/train/data/COCO_train2014_000000005483.jpg,568,640,5483,A store with items on the counter and sign on the door. 
COCO_train2014_000000005483.jpg,/home/harsh/fiftyone/coco-2014/train/data/COCO_train2014_000000005483.jpg,568,640,5483,This restaurant has fresh fruit displayed at a counter.
COCO_train2014_000000005165.jpg,/home/harsh/fiftyone/coco-2014/train/data/COCO_train2014_000000005165.jpg,640,427,5165,"A photo of a person being taken in this picture.
"
COCO_train2014_000000005165.jpg,/home/harsh/fiftyone/coco-2014/train/data/COCO_train2014_000000005165.jpg,640,427,5165,A girl is on a skateboard and a toddler is climbing the fence.  
COCO_train2014_000000005165.jpg,/home/harsh/fiftyone/coco-2014/train/data/COCO_train2014_000000005165.jpg,640,427,5165,A girl standing on a skateboard as a boy is climbed up on a fence.
COCO_train2014_000000005165.jpg,/home/harsh/fiftyone/coco-2014/train/data/COCO_train2014_000000005165.jpg,640,427,5165,a child on a skateboard outdoors next to another child climbing a wooden fence
COCO_train2014_000000005165.jpg,/home/harsh/fiftyone/coco-2014/train/data/COCO_train2014_000000005165.jpg,640,427,5165,Girl on skateboard and boy climbing over a fence.
COCO_train2014_000000003197.jpg,/home/harsh/fiftyone/coco-2014/train/data/COCO_train2014_000000003197.jpg,459,640,3197,A lone female surfer rides a small wave. 
COCO_train2014_000000003197.jpg,/home/harsh/fiftyone/coco-2014/train/data/COCO_train2014_000000003197.jpg,459,640,3197,The surfer is excited for the next big wave.
COCO_train2014_000000003197.jpg,/home/harsh/fiftyone/coco-2014/train/data/COCO_train2014_000000003197.jpg,459,640,3197,"A vista of many blues, sky and sea, culminates in the foreground with a  large person, wearing trunks or shorts, arms outstretched, standing on a surfboard and coming into shore on a small wave."
COCO_train2014_000000003197.jpg,/home/harsh/fiftyone/coco-2014/train/data/COCO_train2014_000000003197.jpg,459,640,3197,A woman in a red shirt surfing in the ocean.
COCO_train2014_000000003197.jpg,/home/harsh/fiftyone/coco-2014/train/data/COCO_train2014_000000003197.jpg,459,640,3197,"A woman riding a wave, balancing with her  arms spread out."
COCO_train2014_000000005016.jpg,/home/harsh/fiftyone/coco-2014/train/data/COCO_train2014_000000005016.jpg,366,500,5016,Two people are surfing on a wave near each other.
COCO_train2014_000000005016.jpg,/home/harsh/fiftyone/coco-2014/train/data/COCO_train2014_000000005016.jpg,366,500,5016,Two young men are surfing a good sized wave to the beach.
COCO_train2014_000000005016.jpg,/home/harsh/fiftyone/coco-2014/train/data/COCO_train2014_000000005016.jpg,366,500,5016,Surfers are riding the waves in the ocean. 
COCO_train2014_000000005016.jpg,/home/harsh/fiftyone/coco-2014/train/data/COCO_train2014_000000005016.jpg,366,500,5016,A couple of people on surfboards in the water.
COCO_train2014_000000005016.jpg,/home/harsh/fiftyone/coco-2014/train/data/COCO_train2014_000000005016.jpg,366,500,5016,A couple of people that are on surfboards in the ocean.
COCO_train2014_000000006465.jpg,/home/harsh/fiftyone/coco-2014/train/data/COCO_train2014_000000006465.jpg,480,640,6465,a person that has a lighter in their hand
COCO_train2014_000000006465.jpg,/home/harsh/fiftyone/coco-2014/train/data/COCO_train2014_000000006465.jpg,480,640,6465,Someone is lighting a birthday candle on top of a pineapple upside down cake.
COCO_train2014_000000006465.jpg,/home/harsh/fiftyone/coco-2014/train/data/COCO_train2014_000000006465.jpg,480,640,6465,A pineapple cake with a 30 candle is being lit.
COCO_train2014_000000006465.jpg,/home/harsh/fiftyone/coco-2014/train/data/COCO_train2014_000000006465.jpg,480,640,6465,A person lighting a 30th birthday candle on a pineapple upside-down cake.
COCO_train2014_000000006465.jpg,/home/harsh/fiftyone/coco-2014/train/data/COCO_train2014_000000006465.jpg,480,640,6465,the person is lighting a cake with candles on it 
COCO_train2014_000000005219.jpg,/home/harsh/fiftyone/coco-2014/train/data/COCO_train2014_000000005219.jpg,640,425,5219,A young girl sitting on top of a bed next to a book shelf
COCO_train2014_000000005219.jpg,/home/harsh/fiftyone/coco-2014/train/data/COCO_train2014_000000005219.jpg,640,425,5219,A kid jumping up on a bed in a room.
COCO_train2014_000000005219.jpg,/home/harsh/fiftyone/coco-2014/train/data/COCO_train2014_000000005219.jpg,640,425,5219,"A toddler wears a pink, white, and green striped hoodie."
