file_name,file_path,height,width,image_id,caption
COCO_train2014_000000006200.jpg,/home/harsh/fiftyone/coco-2014/train/data/COCO_train2014_000000006200.jpg,390,640,6200,a man on a surf board rides in front of a big wave
COCO_train2014_000000006200.jpg,/home/harsh/fiftyone/coco-2014/train/data/COCO_train2014_000000006200.jpg,390,640,6200,A man riding a surfboard on top of a wave.
COCO_train2014_000000006200.jpg,/home/harsh/fiftyone/coco-2014/train/data/COCO_train2014_000000006200.jpg,390,640,6200,A surfer riding a large wave in the ocean
COCO_train2014_000000006200.jpg,/home/harsh/fiftyone/coco-2014/train/data/COCO_train2014_000000006200.jpg,390,640,6200,A surfer is riding a large wave in the ocean.
COCO_train2014_000000006200.jpg,/home/harsh/fiftyone/coco-2014/train/data/COCO_train2014_000000006200.jpg,390,640,6200,A person is riding a wave on a surfboard.
COCO_train2014_000000001308.jpg,/home/harsh/fiftyone/coco-2014/train/data/COCO_train2014_000000001308.jpg,426,640,1308,A man in swim shorts is riding a surf board.
COCO_train2014_000000001308.jpg,/home/harsh/fiftyone/coco-2014/train/data/COCO_train2014_000000001308.jpg,426,640,1308,A surfer is riding a wave in the ocean.
COCO_train2014_000000001308.jpg,/home/harsh/fiftyone/coco-2014/train/data/COCO_train2014_000000001308.jpg,426,640,1308,A fit young man surfing a wave in the ocean.
COCO_train2014_000000001308.jpg,/home/harsh/fiftyone/coco-2014/train/data/COCO_train2014_000000001308.jpg,426,640,1308,A man riding a surfboard on a wave.
COCO_train2014_000000001308.jpg,/home/harsh/fiftyone/coco-2014/train/data/COCO_train2014_000000001308.jpg,426,640,1308,A shirtless man riding shortboard on a wave.
COCO_train2014_000000002752.jpg,/home/harsh/fiftyone/coco-2014/train/data/COCO_train2014_000000002752.jpg,375,500,2752,a group of women are gathered in a living room
COCO_train2014_000000002752.jpg,/home/harsh/fiftyone/coco-2014/train/data/COCO_train2014_000000002752.jpg,375,500,2752,Four people sitting in a circle in a living room
COCO_train2014_000000002752.jpg,/home/harsh/fiftyone/coco-2014/train/data/COCO_train2014_000000002752.jpg,375,500,2752,a bunch of women are sitting together in a room
COCO_train2014_000000002752.jpg,/home/harsh/fiftyone/coco-2014/train/data/COCO_train2014_000000002752.jpg,375,500,2752,The people are eating on the couches. 
COCO_train2014_000000002752.jpg,/home/harsh/fiftyone/coco-2014/train/data/COCO_train2014_000000002752.jpg,375,500,2752,some women sitting in a red living room chairs and a clock
COCO_train2014_000000004189.jpg,/home/harsh/fiftyone/coco-2014/train/data/COCO_train2014_000000004189.jpg,375,500,4189,A bed covered in white blankets in front of a window.
COCO_train2014_000000004189.jpg,/home/harsh/fiftyone/coco-2014/train/data/COCO_train2014_000000004189.jpg,375,500,4189,A bed is shown next to a stand and TV.
COCO_train2014_000000004189.jpg,/home/harsh/fiftyone/coco-2014/train/data/COCO_train2014_000000004189.jpg,375,500,4189,an unmade bed in the middle of a bedroom 
COCO_train2014_000000004189.jpg,/home/harsh/fiftyone/coco-2014/train/data/COCO_train2014_000000004189.jpg,375,500,4189,An unmade bed sits empty in the small bedroom.
COCO_train2014_000000004189.jpg,/home/harsh/fiftyone/coco-2014/train/data/COCO_train2014_000000004189.jpg,375,500,4189,There is a TV next to a hotel bed
COCO_train2014_000000000540.jpg,/home/harsh/fiftyone/coco-2014/train/data/COCO_train2014_000000000540.jpg,425,640,540,An airplane sitting in the middle of a city. 
COCO_train2014_000000000540.jpg,/home/harsh/fiftyone/coco-2014/train/data/COCO_train2014_000000000540.jpg,425,640,540,An airplane on a bridge over a highway.
COCO_train2014_000000000540.jpg,/home/harsh/fiftyone/coco-2014/train/data/COCO_train2014_000000000540.jpg,425,640,540,A large jetliner taking off from an airport runway.
COCO_train2014_000000000540.jpg,/home/harsh/fiftyone/coco-2014/train/data/COCO_train2014_000000000540.jpg,425,640,540,Very large JAL jet taxiing on the runway at airport in urban environment
COCO_train2014_000000000540.jpg,/home/harsh/fiftyone/coco-2014/train/data/COCO_train2014_000000000540.jpg,425,640,540,A JAL airplane taxiing down a runway in a city.
COCO_train2014_000000006336.jpg,/home/harsh/fiftyone/coco-2014/train/data/COCO_train2014_000000006336.jpg,428,640,6336,Four animals grazing on a hill overlooking mountains. 
COCO_train2014_000000006336.jpg,/home/harsh/fiftyone/coco-2014/train/data/COCO_train2014_000000006336.jpg,428,640,6336,Three sheep grazing up in the high mountain plains.
COCO_train2014_000000006336.jpg,/home/harsh/fiftyone/coco-2014/train/data/COCO_train2014_000000006336.jpg,428,640,6336,A grass plain with mountains in the distance and several sheep standing together.
COCO_train2014_000000006336.jpg,/home/harsh/fiftyone/coco-2014/train/data/COCO_train2014_000000006336.jpg,428,640,6336,Grey sheep grazing in a field with mountain backdrop.
COCO_train2014_000000006336.jpg,/home/harsh/fiftyone/coco-2014/train/data/COCO_train2014_000000006336.jpg,428,640,6336,Several sheep in the grass near a mountain range.
COCO_train2014_000000005011.jpg,/home/harsh/fiftyone/coco-2014/train/data/COCO_train2014_000000005011.jpg,480,640,5011,Several animals standing together in an open grassy area.
COCO_train2014_000000005011.jpg,/home/harsh/fiftyone/coco-2014/train/data/COCO_train2014_000000005011.jpg,480,640,5011,A giraffe standing next to a herd of zebra.
COCO_train2014_000000005011.jpg,/home/harsh/fiftyone/coco-2014/train/data/COCO_train2014_000000005011.jpg,480,640,5011,Couple of giraffes in the field with a group of wildebeast
COCO_train2014_000000005011.jpg,/home/harsh/fiftyone/coco-2014/train/data/COCO_train2014_000000005011.jpg,480,640,5011,a large giraffe that is walking on some grass
COCO_train2014_000000005011.jpg,/home/harsh/fiftyone/coco-2014/train/data/COCO_train2014_000000005011.jpg,480,640,5011,A giraffe is walking by its self in the wild
COCO_train2014_000000001712.jpg,/home/harsh/fiftyone/coco-2014/train/data/COCO_train2014_000000001712.jpg,425,640,1712,A large long train on a steel track.
COCO_train2014_000000001712.jpg,/home/harsh/fiftyone/coco-2014/train/data/COCO_train2014_000000001712.jpg,425,640,1712,a red train sitting on a old train track
COCO_train2014_000000001712.jpg,/home/harsh/fiftyone/coco-2014/train/data/COCO_train2014_000000001712.jpg,425,640,1712,A train on the rail road tracks near other railroad tracks.
COCO_train2014_000000001712.jpg,/home/harsh/fiftyone/coco-2014/train/data/COCO_train2014_000000001712.jpg,425,640,1712,a train on a train track with a sky background
COCO_train2014_000000001712.jpg,/home/harsh/fiftyone/coco-2014/train/data/COCO_train2014_000000001712.jpg,425,640,1712,A reddish brown and yellow train on a railroad track.  
COCO_train2014_000000005085.jpg,/home/harsh/fiftyone/coco-2014/train/data/COCO_train2014_000000005085.jpg,640,480,5085,A man standing next to an elephant near a forest.
COCO_train2014_000000005085.jpg,/home/harsh/fiftyone/coco-2014/train/data/COCO_train2014_000000005085.jpg,640,480,5085,People sitting on the back of an elephant while going in the woods. 
COCO_train2014_000000005085.jpg,/home/harsh/fiftyone/coco-2014/train/data/COCO_train2014_000000005085.jpg,640,480,5085,a couple of people ride on an elephant as a man walks next to it 
COCO_train2014_000000005085.jpg,/home/harsh/fiftyone/coco-2014/train/data/COCO_train2014_000000005085.jpg,640,480,5085,A couple of people who are riding on top of an elephant.
COCO_train2014_000000005085.jpg,/home/harsh/fiftyone/coco-2014/train/data/COCO_train2014_000000005085.jpg,640,480,5085,People ride on an elephant while a man stands besides them.
COCO_train2014_000000006253.jpg,/home/harsh/fiftyone/coco-2014/train/data/COCO_train2014_000000006253.jpg,480,640,6253,A group of people in an airport holding their luggage.
COCO_train2014_000000006253.jpg,/home/harsh/fiftyone/coco-2014/train/data/COCO_train2014_000000006253.jpg,480,640,6253,A group of people standing together holding luggage.
COCO_train2014_000000006253.jpg,/home/harsh/fiftyone/coco-2014/train/data/COCO_train2014_000000006253.jpg,480,640,6253,"Four people, one with eyeglasses, with five suitcases "
COCO_train2014_000000006253.jpg,/home/harsh/fiftyone/coco-2014/train/data/COCO_train2014_000000006253.jpg,480,640,6253,"A group of people stand together, luggage in hand."
COCO_train2014_000000006253.jpg,/home/harsh/fiftyone/coco-2014/train/data/COCO_train2014_000000006253.jpg,480,640,6253,Travelers wait in line with their luggage an airport.
COCO_train2014_000000002444.jpg,/home/harsh/fiftyone/coco-2014/train/data/COCO_train2014_000000002444.jpg,427,640,2444,a large horse is attached to a carriage
COCO_train2014_000000002444.jpg,/home/harsh/fiftyone/coco-2014/train/data/COCO_train2014_000000002444.jpg,427,640,2444,A horse pulling a cart near some houses
COCO_train2014_000000002444.jpg,/home/harsh/fiftyone/coco-2014/train/data/COCO_train2014_000000002444.jpg,427,640,2444,A team of Clydsdales hitched to a carriage in front of a building.
COCO_train2014_000000002444.jpg,/home/harsh/fiftyone/coco-2014/train/data/COCO_train2014_000000002444.jpg,427,640,2444,Two horses strapped to the front of a carriage stop in front of a wooden building.
COCO_train2014_000000002444.jpg,/home/harsh/fiftyone/coco-2014/train/data/COCO_train2014_000000002444.jpg,427,640,2444,Two large draught horses harnessed in to a carriage
COCO_train2014_000000002279.jpg,/home/harsh/fiftyone/coco-2014/train/data/COCO_train2014_000000002279.jpg,333,500,2279,Large bunch of green bananas on the tree. 
COCO_train2014_000000002279.jpg,/home/harsh/fiftyone/coco-2014/train/data/COCO_train2014_000000002279.jpg,333,500,2279,A stalk of banana's in a tree still ripe to be picked.
COCO_train2014_000000002279.jpg,/home/harsh/fiftyone/coco-2014/train/data/COCO_train2014_000000002279.jpg,333,500,2279,Green bananas on tree outside with other trees.
COCO_train2014_000000002279.jpg,/home/harsh/fiftyone/coco-2014/train/data/COCO_train2014_000000002279.jpg,333,500,2279,a large cluster of bananas growing on a tree
COCO_train2014_000000002279.jpg,/home/harsh/fiftyone/coco-2014/train/data/COCO_train2014_000000002279.jpg,333,500,2279,a number of banana bunches hanging on plants 
COCO_train2014_000000000634.jpg,/home/harsh/fiftyone/coco-2014/train/data/COCO_train2014_000000000634.jpg,640,427,634,A young man riding a skateboard down a ramp.
COCO_train2014_000000000634.jpg,/home/harsh/fiftyone/coco-2014/train/data/COCO_train2014_000000000634.jpg,640,427,634,A person standing on a skateboard and skating at a park.
COCO_train2014_000000000634.jpg,/home/harsh/fiftyone/coco-2014/train/data/COCO_train2014_000000000634.jpg,640,427,634,A teenager riding a skateboard at a skate park.
COCO_train2014_000000000634.jpg,/home/harsh/fiftyone/coco-2014/train/data/COCO_train2014_000000000634.jpg,640,427,634,A man riding a skateboard on a ramp.
COCO_train2014_000000000634.jpg,/home/harsh/fiftyone/coco-2014/train/data/COCO_train2014_000000000634.jpg,640,427,634,A kid on a skate board riding on a ramp.
COCO_train2014_000000002402.jpg,/home/harsh/fiftyone/coco-2014/train/data/COCO_train2014_000000002402.jpg,375,500,2402,A small child on skis next to a group of adults also on skis.
COCO_train2014_000000002402.jpg,/home/harsh/fiftyone/coco-2014/train/data/COCO_train2014_000000002402.jpg,375,500,2402,a couple of people are standing on some skies
COCO_train2014_000000002402.jpg,/home/harsh/fiftyone/coco-2014/train/data/COCO_train2014_000000002402.jpg,375,500,2402,Adults and children are learning how to ski.
COCO_train2014_000000002402.jpg,/home/harsh/fiftyone/coco-2014/train/data/COCO_train2014_000000002402.jpg,375,500,2402,Group of young children in ski area with adults during competition.
COCO_train2014_000000002402.jpg,/home/harsh/fiftyone/coco-2014/train/data/COCO_train2014_000000002402.jpg,375,500,2402,Small children and a couple of grown ups skiing. 
COCO_train2014_000000003735.jpg,/home/harsh/fiftyone/coco-2014/train/data/COCO_train2014_000000003735.jpg,427,640,3735,"A man riding a surfboard in the middle of the ocean,"
COCO_train2014_000000003735.jpg,/home/harsh/fiftyone/coco-2014/train/data/COCO_train2014_000000003735.jpg,427,640,3735,The surfer is riding a wave in the murky water. 
COCO_train2014_000000003735.jpg,/home/harsh/fiftyone/coco-2014/train/data/COCO_train2014_000000003735.jpg,427,640,3735,A person in the ocean riding a wave while surfing
COCO_train2014_000000003735.jpg,/home/harsh/fiftyone/coco-2014/train/data/COCO_train2014_000000003735.jpg,427,640,3735,A man on a surfboard is riding a wave
COCO_train2014_000000003735.jpg,/home/harsh/fiftyone/coco-2014/train/data/COCO_train2014_000000003735.jpg,427,640,3735,A male surfer in a black suit riding a wave.
COCO_train2014_000000002560.jpg,/home/harsh/fiftyone/coco-2014/train/data/COCO_train2014_000000002560.jpg,640,426,2560,A tennis player getting ready to serve the ball.
COCO_train2014_000000002560.jpg,/home/harsh/fiftyone/coco-2014/train/data/COCO_train2014_000000002560.jpg,640,426,2560,A woman taking a swing at a tennis ball
COCO_train2014_000000002560.jpg,/home/harsh/fiftyone/coco-2014/train/data/COCO_train2014_000000002560.jpg,640,426,2560,A girl dressed all in orange hitting a tennis ball.
COCO_train2014_000000002560.jpg,/home/harsh/fiftyone/coco-2014/train/data/COCO_train2014_000000002560.jpg,640,426,2560,A woman swinging a tennis racquet at a tennis ball.
COCO_train2014_000000002560.jpg,/home/harsh/fiftyone/coco-2014/train/data/COCO_train2014_000000002560.jpg,640,426,2560,"Young woman in orange dress about to serve in tennis game, on blue court with green sides."
COCO_train2014_000000006518.jpg,/home/harsh/fiftyone/coco-2014/train/data/COCO_train2014_000000006518.jpg,480,640,6518,A photo taken of a bridge with a clock tower in the background.
COCO_train2014_000000006518.jpg,/home/harsh/fiftyone/coco-2014/train/data/COCO_train2014_000000006518.jpg,480,640,6518,Far shot of a clock on the side of a building.
COCO_train2014_000000006518.jpg,/home/harsh/fiftyone/coco-2014/train/data/COCO_train2014_000000006518.jpg,480,640,6518,A CITY HAS A CLOCK ON ITS BUILDING 
COCO_train2014_000000006518.jpg,/home/harsh/fiftyone/coco-2014/train/data/COCO_train2014_000000006518.jpg,480,640,6518,A large clock tower sits above a passing train.
COCO_train2014_000000006518.jpg,/home/harsh/fiftyone/coco-2014/train/data/COCO_train2014_000000006518.jpg,480,640,6518,A bus drives across a bridge by a building with a clock.
COCO_train2014_000000004132.jpg,/home/harsh/fiftyone/coco-2014/train/data/COCO_train2014_000000004132.jpg,480,360,4132,a small vase on the ground with a flower 
COCO_train2014_000000004132.jpg,/home/harsh/fiftyone/coco-2014/train/data/COCO_train2014_000000004132.jpg,480,360,4132,A flower is sitting in a glass bottle
COCO_train2014_000000004132.jpg,/home/harsh/fiftyone/coco-2014/train/data/COCO_train2014_000000004132.jpg,480,360,4132,A green vase with just a single flower inside .
COCO_train2014_000000004132.jpg,/home/harsh/fiftyone/coco-2014/train/data/COCO_train2014_000000004132.jpg,480,360,4132,A single yellow flower in a green glass vase
COCO_train2014_000000004132.jpg,/home/harsh/fiftyone/coco-2014/train/data/COCO_train2014_000000004132.jpg,480,360,4132,Flower bud in small green jar on cement
COCO_train2014_000000001145.jpg,/home/harsh/fiftyone/coco-2014/train/data/COCO_train2014_000000001145.jpg,480,640,1145,A woman standing in a kitchen next to jars on a counter.
COCO_train2014_000000001145.jpg,/home/harsh/fiftyone/coco-2014/train/data/COCO_train2014_000000001145.jpg,480,640,1145,A woman canning fruits and vegetables on a kitchen counter with a sauce pot on the stove.
COCO_train2014_000000001145.jpg,/home/harsh/fiftyone/coco-2014/train/data/COCO_train2014_000000001145.jpg,480,640,1145,The woman is putting food inside jars to keep them fresh
COCO_train2014_000000001145.jpg,/home/harsh/fiftyone/coco-2014/train/data/COCO_train2014_000000001145.jpg,480,640,1145,A woman prepares glass jars full of liquid on her counter.
COCO_train2014_000000001145.jpg,/home/harsh/fiftyone/coco-2014/train/data/COCO_train2014_000000001145.jpg,480,640,1145,A woman standing at her kitchen counter canning vegetables.
COCO_train2014_000000005345.jpg,/home/harsh/fiftyone/coco-2014/train/data/COCO_train2014_000000005345.jpg,346,640,5345,This is a picture of a kitchen that is also used as an office
COCO_train2014_000000005345.jpg,/home/harsh/fiftyone/coco-2014/train/data/COCO_train2014_000000005345.jpg,346,640,5345,"A kitchen filled with kitchen accessories, furniture, and decor."
COCO_train2014_000000005345.jpg,/home/harsh/fiftyone/coco-2014/train/data/COCO_train2014_000000005345.jpg,346,640,5345,A long shot of an office and kitchen.
COCO_train2014_000000005345.jpg,/home/harsh/fiftyone/coco-2014/train/data/COCO_train2014_000000005345.jpg,346,640,5345,A kitchen and office area with black granite counter tops and brown cabinets
COCO_train2014_000000005345.jpg,/home/harsh/fiftyone/coco-2014/train/data/COCO_train2014_000000005345.jpg,346,640,5345,A kitchen has brown cabinets and black counter tops.  
COCO_train2014_000000001645.jpg,/home/harsh/fiftyone/coco-2014/train/data/COCO_train2014_000000001645.jpg,612,612,1645,A snow covered filed with animals grazing on it.
COCO_train2014_000000001645.jpg,/home/harsh/fiftyone/coco-2014/train/data/COCO_train2014_000000001645.jpg,612,612,1645,There is a small herd of sheep outside in the winter.
COCO_train2014_000000001645.jpg,/home/harsh/fiftyone/coco-2014/train/data/COCO_train2014_000000001645.jpg,612,612,1645,a bunch of animals standing in the snow
COCO_train2014_000000001645.jpg,/home/harsh/fiftyone/coco-2014/train/data/COCO_train2014_000000001645.jpg,612,612,1645,Altered photograph of sheep in a snowy landscape
COCO_train2014_000000001645.jpg,/home/harsh/fiftyone/coco-2014/train/data/COCO_train2014_000000001645.jpg,612,612,1645,A snapshot of a snowy scene with some telephone poles.
COCO_train2014_000000002400.jpg,/home/harsh/fiftyone/coco-2014/train/data/COCO_train2014_000000002400.jpg,427,640,2400,A man in grey shirt with camera on bench next to two dogs.
COCO_train2014_000000002400.jpg,/home/harsh/fiftyone/coco-2014/train/data/COCO_train2014_000000002400.jpg,427,640,2400,A man sitting on a bench near two dogs
COCO_train2014_000000002400.jpg,/home/harsh/fiftyone/coco-2014/train/data/COCO_train2014_000000002400.jpg,427,640,2400,A man is sitting on a wooden bench with two dogs.
COCO_train2014_000000002400.jpg,/home/harsh/fiftyone/coco-2014/train/data/COCO_train2014_000000002400.jpg,427,640,2400,A couple of dogs and man on a wooden bench.
COCO_train2014_000000002400.jpg,/home/harsh/fiftyone/coco-2014/train/data/COCO_train2014_000000002400.jpg,427,640,2400,A man with a camera sitting on a bench with two dogs.
COCO_train2014_000000004537.jpg,/home/harsh/fiftyone/coco-2014/train/data/COCO_train2014_000000004537.jpg,500,375,4537,A cat is sitting inside of a dish.
COCO_train2014_000000004537.jpg,/home/harsh/fiftyone/coco-2014/train/data/COCO_train2014_000000004537.jpg,500,375,4537,A cat sitting in a bowl on a table.
COCO_train2014_000000004537.jpg,/home/harsh/fiftyone/coco-2014/train/data/COCO_train2014_000000004537.jpg,500,375,4537,A cat with a purple and red collar sitting in a bowl 
COCO_train2014_000000004537.jpg,/home/harsh/fiftyone/coco-2014/train/data/COCO_train2014_000000004537.jpg,500,375,4537,a brown and white Siamese cat is sitting on a table
COCO_train2014_000000004537.jpg,/home/harsh/fiftyone/coco-2014/train/data/COCO_train2014_000000004537.jpg,500,375,4537,A siamese cat sitting on top of a table.
COCO_train2014_000000005344.jpg,/home/harsh/fiftyone/coco-2014/train/data/COCO_train2014_000000005344.jpg,480,640,5344,Two zebra's walking on the grass as they look downward.
COCO_train2014_000000005344.jpg,/home/harsh/fiftyone/coco-2014/train/data/COCO_train2014_000000005344.jpg,480,640,5344,These zebra are walking side by side on green grass.
COCO_train2014_000000005344.jpg,/home/harsh/fiftyone/coco-2014/train/data/COCO_train2014_000000005344.jpg,480,640,5344,Two zebra walk together on the short grass.
COCO_train2014_000000005344.jpg,/home/harsh/fiftyone/coco-2014/train/data/COCO_train2014_000000005344.jpg,480,640,5344,Two zebras walk in grass bounded by trees. 
COCO_train2014_000000005344.jpg,/home/harsh/fiftyone/coco-2014/train/data/COCO_train2014_000000005344.jpg,480,640,5344,Two zebras walking around in the grass together.
COCO_train2014_000000003461.jpg,/home/harsh/fiftyone/coco-2014/train/data/COCO_train2014_000000003461.jpg,505,640,3461,Two men standing on a hill in snow skis.
COCO_train2014_000000003461.jpg,/home/harsh/fiftyone/coco-2014/train/data/COCO_train2014_000000003461.jpg,505,640,3461,Two people stand on skis on a snow covered hill.
COCO_train2014_000000003461.jpg,/home/harsh/fiftyone/coco-2014/train/data/COCO_train2014_000000003461.jpg,505,640,3461,The high mountain is full of snow and skiers.
COCO_train2014_000000003461.jpg,/home/harsh/fiftyone/coco-2014/train/data/COCO_train2014_000000003461.jpg,505,640,3461,Two skiers stop at the top of a hill before beginning their descent.
COCO_train2014_000000003461.jpg,/home/harsh/fiftyone/coco-2014/train/data/COCO_train2014_000000003461.jpg,505,640,3461,A man and woman wearing skis on a ski slope.
COCO_train2014_000000005303.jpg,/home/harsh/fiftyone/coco-2014/train/data/COCO_train2014_000000005303.jpg,480,640,5303,A giant slice of pizza sitting on top of a paper plate.
COCO_train2014_000000005303.jpg,/home/harsh/fiftyone/coco-2014/train/data/COCO_train2014_000000005303.jpg,480,640,5303,A large piece of pizza is sitting on a paper plate.
COCO_train2014_000000005303.jpg,/home/harsh/fiftyone/coco-2014/train/data/COCO_train2014_000000005303.jpg,480,640,5303,A man is holding a large piece of pizza.
COCO_train2014_000000005303.jpg,/home/harsh/fiftyone/coco-2014/train/data/COCO_train2014_000000005303.jpg,480,640,5303,Hand holding a paper plate of cheese pizza.
COCO_train2014_000000005303.jpg,/home/harsh/fiftyone/coco-2014/train/data/COCO_train2014_000000005303.jpg,480,640,5303,A slice of pizza on a white paper plate.
COCO_train2014_000000000828.jpg,/home/harsh/fiftyone/coco-2014/train/data/COCO_train2014_000000000828.jpg,431,640,828,A man on a surfboard in the water.
COCO_train2014_000000000828.jpg,/home/harsh/fiftyone/coco-2014/train/data/COCO_train2014_000000000828.jpg,431,640,828,A man stands on a surf board and holds a paddle.
COCO_train2014_000000000828.jpg,/home/harsh/fiftyone/coco-2014/train/data/COCO_train2014_000000000828.jpg,431,640,828,A man in a cap on a surf board and holding an oar. 
COCO_train2014_000000000828.jpg,/home/harsh/fiftyone/coco-2014/train/data/COCO_train2014_000000000828.jpg,431,640,828,Guy in a cap is paddle surfing on a wave
COCO_train2014_000000000828.jpg,/home/harsh/fiftyone/coco-2014/train/data/COCO_train2014_000000000828.jpg,431,640,828,A man with a paddle riding a wave on a surfboard.
COCO_train2014_000000001397.jpg,/home/harsh/fiftyone/coco-2014/train/data/COCO_train2014_000000001397.jpg,427,640,1397,A man is riding on a surfboard in the ocean.
COCO_train2014_000000001397.jpg,/home/harsh/fiftyone/coco-2014/train/data/COCO_train2014_000000001397.jpg,427,640,1397,A young man riding a surf board on a small wave.
COCO_train2014_000000001397.jpg,/home/harsh/fiftyone/coco-2014/train/data/COCO_train2014_000000001397.jpg,427,640,1397,a person riding a surf board on a wave 
COCO_train2014_000000001397.jpg,/home/harsh/fiftyone/coco-2014/train/data/COCO_train2014_000000001397.jpg,427,640,1397,a man riding a colorful surfboard in the water
COCO_train2014_000000001397.jpg,/home/harsh/fiftyone/coco-2014/train/data/COCO_train2014_000000001397.jpg,427,640,1397,A man is surfing with his yellow and black striped surfboard
COCO_train2014_000000003077.jpg,/home/harsh/fiftyone/coco-2014/train/data/COCO_train2014_000000003077.jpg,640,455,3077,A group of men posing for a picture holding tennis racquets.
COCO_train2014_000000003077.jpg,/home/harsh/fiftyone/coco-2014/train/data/COCO_train2014_000000003077.jpg,640,455,3077,A photo of young men that belong to a tennis club posing in their uniform and rackets
COCO_train2014_000000003077.jpg,/home/harsh/fiftyone/coco-2014/train/data/COCO_train2014_000000003077.jpg,640,455,3077,A group of men and a women lined up holding tennis rackets.
COCO_train2014_000000003077.jpg,/home/harsh/fiftyone/coco-2014/train/data/COCO_train2014_000000003077.jpg,640,455,3077,an old photo of a group of young tennis players
COCO_train2014_000000003077.jpg,/home/harsh/fiftyone/coco-2014/train/data/COCO_train2014_000000003077.jpg,640,455,3077,Tennis players posing for a group photo on the steps in front of a building.
COCO_train2014_000000006664.jpg,/home/harsh/fiftyone/coco-2014/train/data/COCO_train2014_000000006664.jpg,500,475,6664,A man swinging a tennis racket on a court.
COCO_train2014_000000006664.jpg,/home/harsh/fiftyone/coco-2014/train/data/COCO_train2014_000000006664.jpg,500,475,6664,A tennis player by the net with his right leg up.
COCO_train2014_000000006664.jpg,/home/harsh/fiftyone/coco-2014/train/data/COCO_train2014_000000006664.jpg,500,475,6664,A tennis player hitting a ball at the tennis court.
COCO_train2014_000000006664.jpg,/home/harsh/fiftyone/coco-2014/train/data/COCO_train2014_000000006664.jpg,500,475,6664,The tennis player takes a swing with his racquet.
COCO_train2014_000000006664.jpg,/home/harsh/fiftyone/coco-2014/train/data/COCO_train2014_000000006664.jpg,500,475,6664,A man who is holding a tennis racket kicking his right leg in the air.
COCO_train2014_000000004065.jpg,/home/harsh/fiftyone/coco-2014/train/data/COCO_train2014_000000004065.jpg,480,640,4065,The young woman smiles while the older woman frowns.
COCO_train2014_000000004065.jpg,/home/harsh/fiftyone/coco-2014/train/data/COCO_train2014_000000004065.jpg,480,640,4065,Two women sitting next to each other at a dinner table.
