file_name,file_path,height,width,image_id,caption
COCO_train2014_000000004885.jpg,/home/harsh/fiftyone/coco-2014/train/data/COCO_train2014_000000004885.jpg,350,640,4885,A black suitcase with pink writing on it
COCO_train2014_000000004885.jpg,/home/harsh/fiftyone/coco-2014/train/data/COCO_train2014_000000004885.jpg,350,640,4885,"A black suitcase with writing on it, sitting in front of a door."
COCO_train2014_000000004885.jpg,/home/harsh/fiftyone/coco-2014/train/data/COCO_train2014_000000004885.jpg,350,640,4885,A hard black case sits outside a door.
COCO_train2014_000000002849.jpg,/home/harsh/fiftyone/coco-2014/train/data/COCO_train2014_000000002849.jpg,480,640,2849,An elephant carrying a ball with it's trunk on top of grass
COCO_train2014_000000002849.jpg,/home/harsh/fiftyone/coco-2014/train/data/COCO_train2014_000000002849.jpg,480,640,2849,Elephant playing with large ball in outdoor zoo enclosure.
COCO_train2014_000000002849.jpg,/home/harsh/fiftyone/coco-2014/train/data/COCO_train2014_000000002849.jpg,480,640,2849,An elephant is playing with a ball outdoors.
COCO_train2014_000000002849.jpg,/home/harsh/fiftyone/coco-2014/train/data/COCO_train2014_000000002849.jpg,480,640,2849,A very big plump elephant playing with a big ball.
COCO_train2014_000000002849.jpg,/home/harsh/fiftyone/coco-2014/train/data/COCO_train2014_000000002849.jpg,480,640,2849,An elephant plays with a ball in an enclosed area.
COCO_train2014_000000001706.jpg,/home/harsh/fiftyone/coco-2014/train/data/COCO_train2014_000000001706.jpg,518,640,1706,A man kneeling down next to a brown dog.
COCO_train2014_000000001706.jpg,/home/harsh/fiftyone/coco-2014/train/data/COCO_train2014_000000001706.jpg,518,640,1706,a dog that is looking at his self in the mirror
COCO_train2014_000000001706.jpg,/home/harsh/fiftyone/coco-2014/train/data/COCO_train2014_000000001706.jpg,518,640,1706,A man is playing with his dog by the fire place.
COCO_train2014_000000001706.jpg,/home/harsh/fiftyone/coco-2014/train/data/COCO_train2014_000000001706.jpg,518,640,1706,A small dog looking at it's reflection with a man nearby.
COCO_train2014_000000001706.jpg,/home/harsh/fiftyone/coco-2014/train/data/COCO_train2014_000000001706.jpg,518,640,1706,A person holding a dog who is looking at it's self in a mirror.
COCO_train2014_000000004741.jpg,/home/harsh/fiftyone/coco-2014/train/data/COCO_train2014_000000004741.jpg,640,640,4741,Some people are going out to have a good time. 
COCO_train2014_000000004741.jpg,/home/harsh/fiftyone/coco-2014/train/data/COCO_train2014_000000004741.jpg,640,640,4741,A girl on a horse riding in a tourist village 
COCO_train2014_000000004741.jpg,/home/harsh/fiftyone/coco-2014/train/data/COCO_train2014_000000004741.jpg,640,640,4741,a woman riding a horse down a street next to a house
COCO_train2014_000000004741.jpg,/home/harsh/fiftyone/coco-2014/train/data/COCO_train2014_000000004741.jpg,640,640,4741,A woman riding a horse down a street with a helmet on.
COCO_train2014_000000004741.jpg,/home/harsh/fiftyone/coco-2014/train/data/COCO_train2014_000000004741.jpg,640,640,4741,A woman riding a horse down a street with pink and red buildings.
COCO_train2014_000000005210.jpg,/home/harsh/fiftyone/coco-2014/train/data/COCO_train2014_000000005210.jpg,426,640,5210,"Windsurfers on the water, their parachutes high in the air"
COCO_train2014_000000005210.jpg,/home/harsh/fiftyone/coco-2014/train/data/COCO_train2014_000000005210.jpg,426,640,5210,A couple of men riding kite boards on a large body of water.
COCO_train2014_000000005210.jpg,/home/harsh/fiftyone/coco-2014/train/data/COCO_train2014_000000005210.jpg,426,640,5210,A water skier is in the water with a large kite.
COCO_train2014_000000005210.jpg,/home/harsh/fiftyone/coco-2014/train/data/COCO_train2014_000000005210.jpg,426,640,5210,Two men are flying huge flexible kites on a windy beach.
COCO_train2014_000000005210.jpg,/home/harsh/fiftyone/coco-2014/train/data/COCO_train2014_000000005210.jpg,426,640,5210,The people on the beach are flying kites.
COCO_train2014_000000005021.jpg,/home/harsh/fiftyone/coco-2014/train/data/COCO_train2014_000000005021.jpg,375,500,5021,Two women standing in front of a metal yellow bin with a purple teddy bear.
COCO_train2014_000000005021.jpg,/home/harsh/fiftyone/coco-2014/train/data/COCO_train2014_000000005021.jpg,375,500,5021,Two woman trying to fill teddy bears with stuffing
COCO_train2014_000000005021.jpg,/home/harsh/fiftyone/coco-2014/train/data/COCO_train2014_000000005021.jpg,375,500,5021,a woman filling a bear at a build a bear type place 
COCO_train2014_000000005021.jpg,/home/harsh/fiftyone/coco-2014/train/data/COCO_train2014_000000005021.jpg,375,500,5021,Two women stand together and play a game.
COCO_train2014_000000005021.jpg,/home/harsh/fiftyone/coco-2014/train/data/COCO_train2014_000000005021.jpg,375,500,5021,Attendant helping a happy customer retrieve her stuffed animal
COCO_train2014_000000006464.jpg,/home/harsh/fiftyone/coco-2014/train/data/COCO_train2014_000000006464.jpg,427,640,6464,A clock with a sun center piece in the middle of it
COCO_train2014_000000006464.jpg,/home/harsh/fiftyone/coco-2014/train/data/COCO_train2014_000000006464.jpg,427,640,6464,a clock with a gold plated sun on one hand.
COCO_train2014_000000006464.jpg,/home/harsh/fiftyone/coco-2014/train/data/COCO_train2014_000000006464.jpg,427,640,6464,The clock has many intricate carvings on it. 
COCO_train2014_000000006464.jpg,/home/harsh/fiftyone/coco-2014/train/data/COCO_train2014_000000006464.jpg,427,640,6464,A very close up look at a pretty clock.
COCO_train2014_000000006464.jpg,/home/harsh/fiftyone/coco-2014/train/data/COCO_train2014_000000006464.jpg,427,640,6464,A large golden sun block hanging from the side of a building.
COCO_train2014_000000005703.jpg,/home/harsh/fiftyone/coco-2014/train/data/COCO_train2014_000000005703.jpg,500,375,5703,a talbe sitting on a tiled floor holding four vases with flowers
COCO_train2014_000000005703.jpg,/home/harsh/fiftyone/coco-2014/train/data/COCO_train2014_000000005703.jpg,500,375,5703,Tall vases with flowers sit on a table. 
COCO_train2014_000000005703.jpg,/home/harsh/fiftyone/coco-2014/train/data/COCO_train2014_000000005703.jpg,500,375,5703,a glass table with some vase with flowers
COCO_train2014_000000005703.jpg,/home/harsh/fiftyone/coco-2014/train/data/COCO_train2014_000000005703.jpg,500,375,5703,A table decorated with five tall vases with flowers.
COCO_train2014_000000005703.jpg,/home/harsh/fiftyone/coco-2014/train/data/COCO_train2014_000000005703.jpg,500,375,5703,A group of vases filled with water and flowers.
COCO_train2014_000000006647.jpg,/home/harsh/fiftyone/coco-2014/train/data/COCO_train2014_000000006647.jpg,424,640,6647,A kitchen filled with metallic appliances sitting next to a stove.
COCO_train2014_000000006647.jpg,/home/harsh/fiftyone/coco-2014/train/data/COCO_train2014_000000006647.jpg,424,640,6647,A commercial kitchen with an assortment of equipment.
COCO_train2014_000000006647.jpg,/home/harsh/fiftyone/coco-2014/train/data/COCO_train2014_000000006647.jpg,424,640,6647,"A kitchen with a stove, grill, and ovens."
COCO_train2014_000000006647.jpg,/home/harsh/fiftyone/coco-2014/train/data/COCO_train2014_000000006647.jpg,424,640,6647,A commercial kitchen full of stainless steel appliances
COCO_train2014_000000006647.jpg,/home/harsh/fiftyone/coco-2014/train/data/COCO_train2014_000000006647.jpg,424,640,6647,An advanced silver industrial kitchen that is empty of people.
COCO_train2014_000000001282.jpg,/home/harsh/fiftyone/coco-2014/train/data/COCO_train2014_000000001282.jpg,640,426,1282,A giraffe trying to eat leaves on the top of a branch
COCO_train2014_000000001282.jpg,/home/harsh/fiftyone/coco-2014/train/data/COCO_train2014_000000001282.jpg,640,426,1282,Giraffe eating off a tree branch on an open field. 
COCO_train2014_000000001282.jpg,/home/harsh/fiftyone/coco-2014/train/data/COCO_train2014_000000001282.jpg,640,426,1282,a giraffe nibbling on a branch of a tree
COCO_train2014_000000001282.jpg,/home/harsh/fiftyone/coco-2014/train/data/COCO_train2014_000000001282.jpg,640,426,1282,A giraffe stands and puts a tree branch in its mouth.
COCO_train2014_000000001282.jpg,/home/harsh/fiftyone/coco-2014/train/data/COCO_train2014_000000001282.jpg,640,426,1282,a griffa trying to eat leaves that has already been ate
COCO_train2014_000000005313.jpg,/home/harsh/fiftyone/coco-2014/train/data/COCO_train2014_000000005313.jpg,371,640,5313,"people, scooters and many red and yellow buses "
COCO_train2014_000000005313.jpg,/home/harsh/fiftyone/coco-2014/train/data/COCO_train2014_000000005313.jpg,371,640,5313,a few people that are standing next some motorcycles
COCO_train2014_000000005313.jpg,/home/harsh/fiftyone/coco-2014/train/data/COCO_train2014_000000005313.jpg,371,640,5313,"Several people, buses, and mopeds are in a parking lot."
COCO_train2014_000000005313.jpg,/home/harsh/fiftyone/coco-2014/train/data/COCO_train2014_000000005313.jpg,371,640,5313,A row of red and yellow buses with people standing around and a few merchandise stands and parked motorbikes. 
COCO_train2014_000000005313.jpg,/home/harsh/fiftyone/coco-2014/train/data/COCO_train2014_000000005313.jpg,371,640,5313,these men are walking around in a parking lot
COCO_train2014_000000004981.jpg,/home/harsh/fiftyone/coco-2014/train/data/COCO_train2014_000000004981.jpg,438,640,4981,A person with an umbrella walks down the side walk alongside fenced in greenery.
COCO_train2014_000000004981.jpg,/home/harsh/fiftyone/coco-2014/train/data/COCO_train2014_000000004981.jpg,438,640,4981,A woman carrying a bright yellow bag and holding a black umbrella over her head is walking down the sidewalk of a city street.
COCO_train2014_000000004981.jpg,/home/harsh/fiftyone/coco-2014/train/data/COCO_train2014_000000004981.jpg,438,640,4981,"A woman with a big, yellow bag walks next to an iron fence down a leaf strewn sidewalk as she carries a black umbrella. "
COCO_train2014_000000004981.jpg,/home/harsh/fiftyone/coco-2014/train/data/COCO_train2014_000000004981.jpg,438,640,4981,"A woman is walking down an empty sidewalk
"
COCO_train2014_000000004981.jpg,/home/harsh/fiftyone/coco-2014/train/data/COCO_train2014_000000004981.jpg,438,640,4981,A lone woman strolls with a large yellow umbrella.
COCO_train2014_000000000572.jpg,/home/harsh/fiftyone/coco-2014/train/data/COCO_train2014_000000000572.jpg,640,427,572,A man leaning over as she inspects a woman's shoes.
COCO_train2014_000000000572.jpg,/home/harsh/fiftyone/coco-2014/train/data/COCO_train2014_000000000572.jpg,640,427,572,this is two men standing on some stairs
COCO_train2014_000000000572.jpg,/home/harsh/fiftyone/coco-2014/train/data/COCO_train2014_000000000572.jpg,640,427,572,Man standing in front of a woman next to a suitcase. 
COCO_train2014_000000000572.jpg,/home/harsh/fiftyone/coco-2014/train/data/COCO_train2014_000000000572.jpg,640,427,572,a person standing and a person looking down
COCO_train2014_000000000572.jpg,/home/harsh/fiftyone/coco-2014/train/data/COCO_train2014_000000000572.jpg,640,427,572,a man kneeling down looking at a ladies shoes
COCO_train2014_000000005862.jpg,/home/harsh/fiftyone/coco-2014/train/data/COCO_train2014_000000005862.jpg,480,640,5862,A dog laying on top of a couch next to a white dog.
COCO_train2014_000000005862.jpg,/home/harsh/fiftyone/coco-2014/train/data/COCO_train2014_000000005862.jpg,480,640,5862,Two dogs are laying on blankets on a couch.
COCO_train2014_000000005862.jpg,/home/harsh/fiftyone/coco-2014/train/data/COCO_train2014_000000005862.jpg,480,640,5862,This is two dogs relaxing on a couch that has been turned into a bed.
COCO_train2014_000000005862.jpg,/home/harsh/fiftyone/coco-2014/train/data/COCO_train2014_000000005862.jpg,480,640,5862,A pair of dogs laying down on a couch.
COCO_train2014_000000005862.jpg,/home/harsh/fiftyone/coco-2014/train/data/COCO_train2014_000000005862.jpg,480,640,5862,white dog and brown dog resting on sheet covered couch
COCO_train2014_000000002072.jpg,/home/harsh/fiftyone/coco-2014/train/data/COCO_train2014_000000002072.jpg,427,640,2072,Picture of a person during baseball in the air.
COCO_train2014_000000002072.jpg,/home/harsh/fiftyone/coco-2014/train/data/COCO_train2014_000000002072.jpg,427,640,2072,A man wearing a hat and a baseball glove throwing a baseball.
COCO_train2014_000000002072.jpg,/home/harsh/fiftyone/coco-2014/train/data/COCO_train2014_000000002072.jpg,427,640,2072,A man throwing a baseball while wearing a catchers mitt.
COCO_train2014_000000002072.jpg,/home/harsh/fiftyone/coco-2014/train/data/COCO_train2014_000000002072.jpg,427,640,2072,a man throwing a baseball in a field
COCO_train2014_000000002072.jpg,/home/harsh/fiftyone/coco-2014/train/data/COCO_train2014_000000002072.jpg,427,640,2072,A man practicing baseball on a field. 
COCO_train2014_000000006151.jpg,/home/harsh/fiftyone/coco-2014/train/data/COCO_train2014_000000006151.jpg,427,640,6151,A person slices bananas into his bowl. 
COCO_train2014_000000006151.jpg,/home/harsh/fiftyone/coco-2014/train/data/COCO_train2014_000000006151.jpg,427,640,6151,The person is cutting a banana into their oatmeal.
COCO_train2014_000000006151.jpg,/home/harsh/fiftyone/coco-2014/train/data/COCO_train2014_000000006151.jpg,427,640,6151,A person slicing a banana into a white bowl.
COCO_train2014_000000006151.jpg,/home/harsh/fiftyone/coco-2014/train/data/COCO_train2014_000000006151.jpg,427,640,6151,A banana is being cut up into a bowl of cereal.
COCO_train2014_000000006151.jpg,/home/harsh/fiftyone/coco-2014/train/data/COCO_train2014_000000006151.jpg,427,640,6151,A person cuts a banana into a bowl.
COCO_train2014_000000002347.jpg,/home/harsh/fiftyone/coco-2014/train/data/COCO_train2014_000000002347.jpg,480,640,2347,"A small room with a glass table, furniture, and a tv."
COCO_train2014_000000002347.jpg,/home/harsh/fiftyone/coco-2014/train/data/COCO_train2014_000000002347.jpg,480,640,2347,"A living room with furniture, television thrown rug and a window."
COCO_train2014_000000002347.jpg,/home/harsh/fiftyone/coco-2014/train/data/COCO_train2014_000000002347.jpg,480,640,2347,a striped chair and couch a television a rug and tables
COCO_train2014_000000002347.jpg,/home/harsh/fiftyone/coco-2014/train/data/COCO_train2014_000000002347.jpg,480,640,2347,a living room with some couches and television inside of it 
COCO_train2014_000000002347.jpg,/home/harsh/fiftyone/coco-2014/train/data/COCO_train2014_000000002347.jpg,480,640,2347,A small living room with furniture and electronics.
COCO_train2014_000000001298.jpg,/home/harsh/fiftyone/coco-2014/train/data/COCO_train2014_000000001298.jpg,428,640,1298,a man is sitting on the grass eating some food and a drink
COCO_train2014_000000001298.jpg,/home/harsh/fiftyone/coco-2014/train/data/COCO_train2014_000000001298.jpg,428,640,1298,It's good to take off your shoes and relax in the sun for lunch.
COCO_train2014_000000001298.jpg,/home/harsh/fiftyone/coco-2014/train/data/COCO_train2014_000000001298.jpg,428,640,1298,A man cutting food with a pair of blue scissors. 
COCO_train2014_000000001298.jpg,/home/harsh/fiftyone/coco-2014/train/data/COCO_train2014_000000001298.jpg,428,640,1298,A man sitting with his back up against a tree.
COCO_train2014_000000001298.jpg,/home/harsh/fiftyone/coco-2014/train/data/COCO_train2014_000000001298.jpg,428,640,1298,The man is enjoying a snack at the park.
COCO_train2014_000000003640.jpg,/home/harsh/fiftyone/coco-2014/train/data/COCO_train2014_000000003640.jpg,640,480,3640,A cupboard door with shiny glass reflecting a window.
COCO_train2014_000000003640.jpg,/home/harsh/fiftyone/coco-2014/train/data/COCO_train2014_000000003640.jpg,640,480,3640,Window shutters reflected in a medicine cabinet mirror.
COCO_train2014_000000003640.jpg,/home/harsh/fiftyone/coco-2014/train/data/COCO_train2014_000000003640.jpg,640,480,3640,A reflection of an open window in a mirror.
COCO_train2014_000000003640.jpg,/home/harsh/fiftyone/coco-2014/train/data/COCO_train2014_000000003640.jpg,640,480,3640,A mirrored cabin reflects a broken white window
COCO_train2014_000000003640.jpg,/home/harsh/fiftyone/coco-2014/train/data/COCO_train2014_000000003640.jpg,640,480,3640,"Looking at a reflection of a window, through a mirror."
COCO_train2014_000000004309.jpg,/home/harsh/fiftyone/coco-2014/train/data/COCO_train2014_000000004309.jpg,640,480,4309,a person that is standing around in a bathroom
COCO_train2014_000000004309.jpg,/home/harsh/fiftyone/coco-2014/train/data/COCO_train2014_000000004309.jpg,640,480,4309,a woman is sitting down in a bathroom
COCO_train2014_000000004309.jpg,/home/harsh/fiftyone/coco-2014/train/data/COCO_train2014_000000004309.jpg,640,480,4309,A person who is touching their toes in the bathroom.
COCO_train2014_000000004309.jpg,/home/harsh/fiftyone/coco-2014/train/data/COCO_train2014_000000004309.jpg,640,480,4309,A view of a woman bent over and drying off in a bathroom. 
COCO_train2014_000000004309.jpg,/home/harsh/fiftyone/coco-2014/train/data/COCO_train2014_000000004309.jpg,640,480,4309,Someone getting ready to take a hot bath. 
COCO_train2014_000000002377.jpg,/home/harsh/fiftyone/coco-2014/train/data/COCO_train2014_000000002377.jpg,427,640,2377,A group of people on motor bikes on a road.
COCO_train2014_000000002377.jpg,/home/harsh/fiftyone/coco-2014/train/data/COCO_train2014_000000002377.jpg,427,640,2377,A gang of bikers riding down a dirt road.
COCO_train2014_000000002377.jpg,/home/harsh/fiftyone/coco-2014/train/data/COCO_train2014_000000002377.jpg,427,640,2377,a match among cyclist and other people watching
COCO_train2014_000000002377.jpg,/home/harsh/fiftyone/coco-2014/train/data/COCO_train2014_000000002377.jpg,427,640,2377,Black and white picture of a motorcycle racing.
COCO_train2014_000000002377.jpg,/home/harsh/fiftyone/coco-2014/train/data/COCO_train2014_000000002377.jpg,427,640,2377,Several motorcyclists driving on a dirt road while people are watching. 
COCO_train2014_000000005482.jpg,/home/harsh/fiftyone/coco-2014/train/data/COCO_train2014_000000005482.jpg,482,640,5482,There is a plane a the airport during the night.
COCO_train2014_000000005482.jpg,/home/harsh/fiftyone/coco-2014/train/data/COCO_train2014_000000005482.jpg,482,640,5482, Commercial airliner parked at gate at city airport.
COCO_train2014_000000005482.jpg,/home/harsh/fiftyone/coco-2014/train/data/COCO_train2014_000000005482.jpg,482,640,5482,A runway with an airplane parked on it and the traffic controller is to the right and behind them is a view of buildings lit up.
COCO_train2014_000000005482.jpg,/home/harsh/fiftyone/coco-2014/train/data/COCO_train2014_000000005482.jpg,482,640,5482,a large airplane is parked at a terminal
COCO_train2014_000000005482.jpg,/home/harsh/fiftyone/coco-2014/train/data/COCO_train2014_000000005482.jpg,482,640,5482,a large air plane in a run way
COCO_train2014_000000004647.jpg,/home/harsh/fiftyone/coco-2014/train/data/COCO_train2014_000000004647.jpg,458,640,4647,a duck swims through the water by itself 
COCO_train2014_000000004647.jpg,/home/harsh/fiftyone/coco-2014/train/data/COCO_train2014_000000004647.jpg,458,640,4647,A black duck floating in a greenish pond. 
COCO_train2014_000000004647.jpg,/home/harsh/fiftyone/coco-2014/train/data/COCO_train2014_000000004647.jpg,458,640,4647,A black duck swimming on top of a body of water.
COCO_train2014_000000004647.jpg,/home/harsh/fiftyone/coco-2014/train/data/COCO_train2014_000000004647.jpg,458,640,4647,A black duck is swimming in the water.
COCO_train2014_000000004647.jpg,/home/harsh/fiftyone/coco-2014/train/data/COCO_train2014_000000004647.jpg,458,640,4647,a duck that is sitting on a pond
COCO_train2014_000000003321.jpg,/home/harsh/fiftyone/coco-2014/train/data/COCO_train2014_000000003321.jpg,480,640,3321,Two brown and white cows graze in a pasture
COCO_train2014_000000003321.jpg,/home/harsh/fiftyone/coco-2014/train/data/COCO_train2014_000000003321.jpg,480,640,3321,Two cows grazing on a fenced field with grass 
COCO_train2014_000000003321.jpg,/home/harsh/fiftyone/coco-2014/train/data/COCO_train2014_000000003321.jpg,480,640,3321,Two spotted cows eating grass in a field.
COCO_train2014_000000003321.jpg,/home/harsh/fiftyone/coco-2014/train/data/COCO_train2014_000000003321.jpg,480,640,3321,Two cows stand in a pasture eating grass.
COCO_train2014_000000003321.jpg,/home/harsh/fiftyone/coco-2014/train/data/COCO_train2014_000000003321.jpg,480,640,3321,Two cows are eating is eating grass in a field.
COCO_train2014_000000006031.jpg,/home/harsh/fiftyone/coco-2014/train/data/COCO_train2014_000000006031.jpg,640,419,6031,A man wearing a suit is standing and looking at a book.
COCO_train2014_000000006031.jpg,/home/harsh/fiftyone/coco-2014/train/data/COCO_train2014_000000006031.jpg,640,419,6031,A man standing up and looking at a book.
COCO_train2014_000000006031.jpg,/home/harsh/fiftyone/coco-2014/train/data/COCO_train2014_000000006031.jpg,640,419,6031,A man in a suit and tie standing behind a table.
COCO_train2014_000000006031.jpg,/home/harsh/fiftyone/coco-2014/train/data/COCO_train2014_000000006031.jpg,640,419,6031,A speaker reading from his notes while presenting
COCO_train2014_000000006031.jpg,/home/harsh/fiftyone/coco-2014/train/data/COCO_train2014_000000006031.jpg,640,419,6031,A man with a tie standing at a desk.
COCO_train2014_000000004971.jpg,/home/harsh/fiftyone/coco-2014/train/data/COCO_train2014_000000004971.jpg,480,640,4971,Boats sitting out on the calm water of a lake.
COCO_train2014_000000004971.jpg,/home/harsh/fiftyone/coco-2014/train/data/COCO_train2014_000000004971.jpg,480,640,4971,some water and some boats are docked 
COCO_train2014_000000004971.jpg,/home/harsh/fiftyone/coco-2014/train/data/COCO_train2014_000000004971.jpg,480,640,4971,A group of speed boats are docked off an ocean shore. 
COCO_train2014_000000004971.jpg,/home/harsh/fiftyone/coco-2014/train/data/COCO_train2014_000000004971.jpg,480,640,4971,a goup of boat out on the water ocean
COCO_train2014_000000004971.jpg,/home/harsh/fiftyone/coco-2014/train/data/COCO_train2014_000000004971.jpg,480,640,4971,Some boats in a harbor are tied together. 
COCO_train2014_000000004684.jpg,/home/harsh/fiftyone/coco-2014/train/data/COCO_train2014_000000004684.jpg,480,640,4684,Two women in costume standing next to a man in a suit.
COCO_train2014_000000004684.jpg,/home/harsh/fiftyone/coco-2014/train/data/COCO_train2014_000000004684.jpg,480,640,4684,A group of people at a dance banquet in formal wear
COCO_train2014_000000004684.jpg,/home/harsh/fiftyone/coco-2014/train/data/COCO_train2014_000000004684.jpg,480,640,4684,Three people pose together on a dance floor.
COCO_train2014_000000004684.jpg,/home/harsh/fiftyone/coco-2014/train/data/COCO_train2014_000000004684.jpg,480,640,4684,Two women and a man posing for a photo on the dance floor.
COCO_train2014_000000004684.jpg,/home/harsh/fiftyone/coco-2014/train/data/COCO_train2014_000000004684.jpg,480,640,4684,A group of happy people dancing on a white floor.
COCO_train2014_000000001183.jpg,/home/harsh/fiftyone/coco-2014/train/data/COCO_train2014_000000001183.jpg,480,640,1183,A guy playing with a Frisbee outside during the daytime.
COCO_train2014_000000001183.jpg,/home/harsh/fiftyone/coco-2014/train/data/COCO_train2014_000000001183.jpg,480,640,1183,A man stands as a frisbee flies through the air.
COCO_train2014_000000001183.jpg,/home/harsh/fiftyone/coco-2014/train/data/COCO_train2014_000000001183.jpg,480,640,1183,A man in a park has just thrown a frisbee.
COCO_train2014_000000001183.jpg,/home/harsh/fiftyone/coco-2014/train/data/COCO_train2014_000000001183.jpg,480,640,1183,A man throwing a frisbee in a green field.
COCO_train2014_000000001183.jpg,/home/harsh/fiftyone/coco-2014/train/data/COCO_train2014_000000001183.jpg,480,640,1183,Man throwing a red Frisbee in a park.
COCO_train2014_000000002758.jpg,/home/harsh/fiftyone/coco-2014/train/data/COCO_train2014_000000002758.jpg,640,549,2758,A man flying through the air while riding skis.
COCO_train2014_000000002758.jpg,/home/harsh/fiftyone/coco-2014/train/data/COCO_train2014_000000002758.jpg,640,549,2758,A skier doing tricks in the air  on a clear day
COCO_train2014_000000002758.jpg,/home/harsh/fiftyone/coco-2014/train/data/COCO_train2014_000000002758.jpg,640,549,2758,A person on skis is jumping in the air.
COCO_train2014_000000002758.jpg,/home/harsh/fiftyone/coco-2014/train/data/COCO_train2014_000000002758.jpg,640,549,2758,A man wearing skis vertical in the air.
COCO_train2014_000000002758.jpg,/home/harsh/fiftyone/coco-2014/train/data/COCO_train2014_000000002758.jpg,640,549,2758,A free-style skier catches some air while doing a trick.
COCO_train2014_000000004138.jpg,/home/harsh/fiftyone/coco-2014/train/data/COCO_train2014_000000004138.jpg,386,640,4138,A boy doing a skateboard trick at a skatepark.
COCO_train2014_000000004138.jpg,/home/harsh/fiftyone/coco-2014/train/data/COCO_train2014_000000004138.jpg,386,640,4138,a skateboarder in a brown shirt is doing a trick
COCO_train2014_000000004138.jpg,/home/harsh/fiftyone/coco-2014/train/data/COCO_train2014_000000004138.jpg,386,640,4138,A boy flips a skateboard underneath him in a skate park.
COCO_train2014_000000004138.jpg,/home/harsh/fiftyone/coco-2014/train/data/COCO_train2014_000000004138.jpg,386,640,4138,A man jumping with a skateboard at a skate park.
COCO_train2014_000000004138.jpg,/home/harsh/fiftyone/coco-2014/train/data/COCO_train2014_000000004138.jpg,386,640,4138,A guy flipping a skateboard in the air.
COCO_train2014_000000001774.jpg,/home/harsh/fiftyone/coco-2014/train/data/COCO_train2014_000000001774.jpg,424,640,1774,there is a an riding a skateboard in a ramp 
COCO_train2014_000000001774.jpg,/home/harsh/fiftyone/coco-2014/train/data/COCO_train2014_000000001774.jpg,424,640,1774,A guy on a skateboard in a skate pool.
COCO_train2014_000000001774.jpg,/home/harsh/fiftyone/coco-2014/train/data/COCO_train2014_000000001774.jpg,424,640,1774,A boy lifts the front wheels of his skateboard as he rides along the bottom of a pool.
